{
  "schema_version": "1.0",
  "result_kind": "normalized_content",
  "attempt_id": "01j4w4hy5kd6zmx4pc4k2xv7br",
  "observation_id": "01j4w4j0k7hm9j9tx3jz8s2n5q",
  "state": "succeeded",
  "source": {
    "requested_url": "https://example.org/docs",
    "normalized_requested_url": "https://example.org/docs",
    "final_url": "https://example.org/docs/",
    "http_status": 200,
    "mime_type": "text/html",
    "charset": "utf-8"
  },
  "normalized_markdown": {
    "handle_id": "01j4w4j8v3wx04ssprfy0dnt80",
    "slot": "normalized_markdown",
    "sha256": "aaaaaaaaaaaaaaaaaaaaaaaaaaaaaaaaaaaaaaaaaaaaaaaaaaaaaaaaaaaaaaaa",
    "size_bytes": 142,
    "mime_type": "text/markdown",
    "encoding": "utf-8"
  },
  "metadata": {
    "title": "Example documentation",
    "description": "A deterministic fixture page.",
    "authors": ["Example Author"],
    "language": "en",
    "published_at": null,
    "modified_at": "2026-08-09T12:00:00Z",
    "word_count": 18,
    "character_count": 142
  },
  "links": [
    {
      "ordinal": 0,
      "url": "https://example.org/about",
      "text": "About",
      "rel": "",
      "same_origin": true,
      "nofollow": false
    }
  ],
  "quality": {
    "score": 0.93,
    "main_content_ratio": 0.86,
    "challenge_detected": false,
    "schema_valid": true
  },
  "provenance": {
    "worker_id": "browserd-fixture-1",
    "engine": "crawlee-cheerio",
    "engine_version": "fixture-1",
    "extractor_chain": ["readability-fixture-1"],
    "sanitizer_version": "webx-sanitize-v1",
    "normalizer_version": "webx-normalize-v1"
  },
  "trust": "untrusted_external_source",
  "security_labels": ["instruction_like_text"],
  "raw_evidence": [
    {
      "handle_id": "01j4w4j8gv95v1x2n7e1ss6q61",
      "slot": "raw_response",
      "sha256": "bbbbbbbbbbbbbbbbbbbbbbbbbbbbbbbbbbbbbbbbbbbbbbbbbbbbbbbbbbbbbbbb",
      "size_bytes": 512,
      "mime_type": "text/html"
    }
  ],
  "warnings": []
}
